{
  "schema_version": "1.0", "skill_code": "business-investment-assessment", "version": "1.0", "content_sha256": "480e67be1d98e57f2a65c06f0ee29c7679f623a8b90351f0ae9b36b234059777",
  "input_schema": {"type": "object", "additionalProperties": false, "required": ["evidence_ids"], "properties": {"evidence_ids": {"type": "array", "minItems": 1, "items": {"type": "string", "format": "uuid"}}}},
  "output_schema": {"type": "object", "additionalProperties": false, "required": ["findings"], "properties": {"findings": {"type": "array", "items": {"type": "object"}}}},
  "preconditions": ["evidence_available"], "permissions": ["evidence.read", "public_research.read"], "failure_classes": ["VALIDATION", "DEPENDENCY", "BUDGET"], "budget": {"max_cost": 0, "currency": "unit"}, "evidence_requirements": ["source_url_or_material_hash"], "lifecycle": {"status": "APPROVED", "rollback": "disable version"}, "may_write_business_state": false
}
